{
  "kai": 16,
  "season": "H17",
  "season_label": "平成17年度",
  "source": {
    "hub_url": "https://toushouren.world.coocan.jp/sub9-H17.htm",
    "ichiran_pdf": "https://toushouren.world.coocan.jp/shadan/roku/1605.pdf"
  },
  "teams": [
    {
      "team_id": "shiryukai_univ",
      "team_name": "立教大学紫龍会",
      "kai": 16,
      "division": "2部白",
      "rank": 8,
      "points": 7,
      "wins": 53,
      "promotion": null,
      "source_type": "shadan_pdf",
      "source_url": "https://toushouren.world.coocan.jp/shadan/roku/1605.pdf",
      "league_table": null,
      "note": "7勝8敗。"
    },
    {
      "team_id": "shiryukai",
      "team_name": "紫龍会",
      "kai": 16,
      "division": "3部緑",
      "rank": 9,
      "points": 7,
      "wins": 56,
      "promotion": null,
      "source_type": "shadan_pdf",
      "source_url": "https://toushouren.world.coocan.jp/shadan/roku/1605.pdf",
      "league_table": null,
      "note": "7勝8敗。"
    }
  ]
}