{
  "kai": 24,
  "season": "H25",
  "season_label": "平成25年度",
  "source": {
    "hub_url": "https://toushouren.world.coocan.jp/shadan/sub9-H25.htm",
    "ichiran_pdf": "https://toushouren.world.coocan.jp/shadan/24/5nitimeitiran.pdf"
  },
  "teams": [
    {
      "team_id": "shiryukai",
      "team_name": "紫龍会",
      "kai": 24,
      "division": "3部白",
      "rank": 7,
      "points": 9,
      "wins": 53,
      "promotion": null,
      "source_type": "shadan_pdf",
      "source_url": "https://toushouren.world.coocan.jp/shadan/24/5nitimeitiran.pdf",
      "league_table": null,
      "note": ""
    }
  ]
}