{
  "kai": 20,
  "season": "H21",
  "season_label": "平成21年度",
  "source": {
    "hub_url": "https://toushouren.world.coocan.jp/sub9-H21.htm",
    "ichiran_pdf": "https://toushouren.world.coocan.jp/shadan/20/page2003.pdf"
  },
  "teams": [
    {
      "team_id": "shiryukai_univ",
      "team_name": "立教大学紫龍会",
      "kai": 20,
      "division": "2部赤",
      "rank": 9,
      "points": 8,
      "wins": 57,
      "promotion": null,
      "source_type": "shadan_pdf",
      "source_url": "https://toushouren.world.coocan.jp/shadan/20/page2003.pdf",
      "league_table": null,
      "note": "8勝7敗。この回を最後に第26回まで休会し、第27回に3部で復帰。"
    },
    {
      "team_id": "shiryukai",
      "team_name": "紫龍会",
      "kai": 20,
      "division": "4部白",
      "rank": 4,
      "points": 11,
      "wins": 64,
      "promotion": "昇級",
      "source_type": "shadan_pdf",
      "source_url": "https://toushouren.world.coocan.jp/shadan/20/page2003.pdf",
      "league_table": null,
      "note": "11勝4敗。この順位一覧に凡例行が無いため昇降の直接記載はなし。翌回3部青所属より昇級と判定。"
    }
  ]
}