{
  "kai": 30,
  "season": "R01",
  "season_label": "令和1年度",
  "source": {
    "hub_url": "https://toushouren.world.coocan.jp/shadan/sub9-R01.htm",
    "ichiran_pdf": "https://toushouren.world.coocan.jp/shadan/30/5nitimeitiran1.pdf"
  },
  "teams": [
    {
      "team_id": "shiryukai_univ",
      "team_name": "立教大紫龍会",
      "kai": 30,
      "division": "5部白",
      "rank": 9,
      "points": 8,
      "wins": 56,
      "promotion": null,
      "source_type": "shadan_pdf",
      "source_url": "https://toushouren.world.coocan.jp/shadan/30/5nitimeitiran1.pdf",
      "league_table": null,
      "note": ""
    }
  ]
}