{
  "kai": 17,
  "season": "H18",
  "season_label": "平成18年度",
  "source": {
    "hub_url": "https://toushouren.world.coocan.jp/sub9-H18.htm",
    "ichiran_pdf": "https://toushouren.world.coocan.jp/17shadan2.htm"
  },
  "teams": [
    {
      "team_id": "shiryukai_univ",
      "team_name": "立教大学紫龍会",
      "kai": 17,
      "division": "2部赤",
      "rank": 2,
      "points": null,
      "wins": null,
      "promotion": "昇級",
      "source_type": "shadan_pdf",
      "source_url": "https://toushouren.world.coocan.jp/17shadan2.htm",
      "league_table": null,
      "note": "公式結果ページで2部赤2位。翌回1部所属より昇級と判定。勝点等の記載資料は現存しない。"
    },
    {
      "team_id": "shiryukai",
      "team_name": "紫龍会",
      "kai": 17,
      "division": "3部緑",
      "rank": null,
      "points": null,
      "wins": null,
      "promotion": null,
      "source_type": "shadan_pdf",
      "source_url": "https://toushouren.world.coocan.jp/shadan/nana/1/17tennsu3g.htm",
      "league_table": null,
      "note": "所属は部別レーティング一覧より。リーグ表が現存せず順位は不明。"
    }
  ]
}