{
  "kai": 28,
  "season": "H29",
  "season_label": "平成29年度",
  "source": {
    "hub_url": "https://toushouren.world.coocan.jp/shadan/sub9-H29.htm",
    "ichiran_pdf": "https://toushouren.world.coocan.jp/shadan/28/5nitimeseisekijun1.pdf"
  },
  "teams": [
    {
      "team_id": "shiryukai_univ",
      "team_name": "立教大紫龍会",
      "kai": 28,
      "division": "4部白",
      "rank": 16,
      "points": 2,
      "wins": 36,
      "promotion": "降級",
      "source_type": "shadan_pdf",
      "source_url": "https://toushouren.world.coocan.jp/shadan/28/5nitimeseisekijun1.pdf",
      "league_table": null,
      "note": "翌回5部赤所属より判定。"
    }
  ]
}